<?xml version="1.0" encoding="UTF-8"?>
<xs:schema xmlns:xs="http://www.w3.org/2001/XMLSchema">

<xs:element name="shape">
    <xs:complexType>
      <xs:sequence>
		<xs:element name="header"> 
		  <xs:complexType>
			<xs:sequence>
				<xs:element name="name" type="xs:string"/>
				<xs:element name="description" type="xs:string"/>
				<xs:element name="creator" type="xs:string"/>
				<xs:element name="timestamp" type="xs:string"/>
				<xs:element name="version" type="xs:string"/>
				<xs:element name="shapeVersion" type="xs:string"/>
			</xs:sequence>
		  </xs:complexType>
		</xs:element>
		<xs:element name="cube"> 
		  <xs:complexType>
			<xs:sequence>
			  <xs:element name="profiles">
				  <xs:complexType>
					<xs:sequence>
					  <xs:element name="cubeProfile" minOccurs ="1" maxOccurs ="unbounded">
						  <xs:complexType>
							<xs:sequence>
							  <xs:element name="name" type="xs:string"/>
							  <xs:element name="description" type="xs:string"/>
							  <xs:element name="pointList">
								  <xs:complexType>
									<xs:sequence>
									  <xs:element name="x" type="xs:string"/>
									  <xs:element name="y" type="xs:string"/>
									  <xs:element name="z" type="xs:string"/>
									</xs:sequence>
								  </xs:complexType>								  
							  </xs:element>
							  <xs:element name="colorList" minOccurs="0">
								  <xs:complexType>
									<xs:sequence>
									  <xs:element name="color" type="xs:string"/>
									</xs:sequence>
								  </xs:complexType>								  
							  </xs:element>							  
							</xs:sequence>
							<xs:attribute  name="id" type="xs:string" use="required"/>
						  </xs:complexType>		
					  </xs:element>
					</xs:sequence>
				  </xs:complexType>
				  <xs:unique name="UniqueCubeProfile">
					<xs:selector xpath="cubeProfile"/> 
					<xs:field xpath="@id"/> 
				  </xs:unique>
			  </xs:element>
			</xs:sequence>
		  </xs:complexType>
		</xs:element>	  
	  </xs:sequence>
	</xs:complexType>
  </xs:element>
</xs:schema>