<?xml version="1.0" encoding="ISO-8859-1"?>
<shape xmlns="http://meinnamespace.meinefirmarrr.de"
          xsi:schemaLocation="http://meinnamespace.meinefirmarrr.de ShapeSchema.xsd">
  <header>
    <name>cube test</name>
    <description>Simple Cube test</description>
    <creator>Rene Frank</creator>
    <timestamp>2016-03-04</timestamp>
    <version>0.0</version>
    <shapeVersion>2.0</shapeVersion>
  </header>
  <cube>	
	<profiles>
       <cubeProfile id="uid_1">
         <name>Cube 1</name>
         <description>Profile build up from set of Points on Circle where may Dimensions are 1..-1</description>
         <pointList>
           <x>0.0;0.0;0.0;0.0;0.0</x>
           <y>0.0;1.0;0.0;-1.0;0.0</y>
           <z>1.0;0.0;-1.0;0.0;1.0</z>
         </pointList>
       </cubeProfile>
    </profiles>
  </cube>  
</shape>
